{"definitionLocks":[{"id":"conformance:assembly","sha256":"918509611bc1f986f8f81bc7dd17a7cfa70016975165c7635fc25d2d9fa64fb7","version":"1"},{"id":"conformance:door","sha256":"a34bb6483d0c2afccaa2107361db342f93a6a661ba1f8a8b6dba1326ddb5df0c","version":"1"},{"id":"conformance:roof","sha256":"6fcaf93bb62e337bde63c7458a88f897a5c43f9421ff5ae7af9401757318503a","version":"1"},{"id":"conformance:slab","sha256":"00d8ada53721e57ab5c60862ba2ac156261fe53978368af0eaf5cb923f55c23d","version":"1"},{"id":"conformance:stairs","sha256":"ade4d7b8905116ef11dcdb540d2994553fb6b273e37b675a5054038693a2533d","version":"1"},{"id":"conformance:wall","sha256":"4c11e5238a3a26c06b73387e5aa1fba2f004743d8bd2da4baa532e9b2d06b81b","version":"1"}],"hostData":{"character":{"ap":0,"hp":37,"stamina":6.5},"clock":{"seconds":4.75},"rng":{"cursor":2,"stream":[0.2,0.5]}},"kind":"nautilus-parts-runtime-save","profileId":"bounded-parts-runtime-v1","runtime":{"actors":[{"floorId":"floor-0","heightM":1.7,"id":"player","position":{"h":0.48720314952444677,"x":5.873288664241933,"y":6},"radiusM":0.25,"revision":7,"speedMps":2,"traversal":{"direction":1,"distanceM":1,"path":[{"h":0,"x":5,"y":6},{"h":0,"x":5,"y":6},{"h":2.12,"x":8.8,"y":6},{"h":2.12,"x":10.1,"y":6}],"stairId":"fp:stairs:YS1zdGFpcnM:ZmxpZ2h0"}}],"claimedEvents":["parts-conformance-yard/interactions/1","parts-conformance-yard/interactions/2"],"initialActors":[{"floorId":"floor-0","heightM":1.7,"id":"player","position":{"h":0,"x":4.5,"y":1.5},"radiusM":0.25,"revision":0,"speedMps":2,"traversal":null}],"interactions":{"doors":[{"closedBounds":{"max":{"h":1.85,"x":4.970000000000001,"y":3.02},"min":{"h":0,"x":4.03,"y":2.98}},"floorId":"floor-0","id":"fp:door:YS1kb29y:bGVhZg","label":"Shared hinged door / leaf","locked":false,"motionBounds":{"max":{"h":1.85,"x":4.9702127418834525,"y":3.02},"min":{"h":0,"x":4.010000000000001,"y":2.0597872581165473}},"open":true,"openBounds":{"max":{"h":1.85,"x":4.05,"y":3},"min":{"h":0,"x":4.010000000000001,"y":2.06}},"position":{"h":0,"x":4.5,"y":3},"reachM":1.6}],"kind":"nautilus-standard-interactions","profile":"bounded-kinematic-v1","revision":2,"stairs":[{"bidirectional":true,"clearanceM":2,"from":{"floorId":"floor-0","position":{"h":0,"x":5,"y":6},"surfaceId":"fp:surface:YS1ncm91bmQ:ZGVjaw:0"},"id":"fp:stairs:YS1zdGFpcnM:ZmxpZ2h0","label":"Shared route stair / flight","path":[{"h":0,"x":5,"y":6},{"h":2.12,"x":8.8,"y":6},{"h":2.12,"x":10.1,"y":6}],"reachM":0.75,"to":{"floorId":"floor-1","position":{"h":2.12,"x":10.1,"y":6},"surfaceId":"fp:surface:YS11cHBlcg:ZGVjaw:6"},"widthM":1.2}],"version":1,"worldId":"parts-conformance-yard"},"journal":[{"command":{"actorId":"player","expectedRevision":0,"id":"fixture-1","operation":{"intent":{"actorId":"player","actorRevision":0,"kind":"open-door","targetId":"fp:door:YS1kb29y:bGVhZg","worldId":"parts-conformance-yard","worldRevision":0},"kind":"interact"},"sceneId":"scene:01ee46dde57641bdd295abe06cce10cf4c1b63c569354b4775561fb9f52bb77c"},"commandHash":"baca18a7e6990f8530882820524530b0f7c51569a70894a6769d8a7d3fa6e64a","events":[{"actorId":"player","id":"parts-conformance-yard/interactions/1","targetId":"fp:door:YS1kb29y:bGVhZg","type":"door-opened","worldId":"parts-conformance-yard"}],"type":"action"},{"command":{"actorId":"player","expectedRevision":1,"id":"fixture-2","operation":{"direction":{"x":0,"y":1},"kind":"walk","seconds":1},"sceneId":"scene:01ee46dde57641bdd295abe06cce10cf4c1b63c569354b4775561fb9f52bb77c"},"commandHash":"7ac35e77617a821cae1f3fa0997671a25888aa721cd131adeb2b6467107f4a44","events":[],"type":"action"},{"command":{"actorId":"player","expectedRevision":2,"id":"fixture-3","operation":{"direction":{"x":0,"y":1},"kind":"walk","seconds":1},"sceneId":"scene:01ee46dde57641bdd295abe06cce10cf4c1b63c569354b4775561fb9f52bb77c"},"commandHash":"18bfab1f2c16dfe49acc39304be6bc0bcdd0bf9e22440f9261e570c460510510","events":[],"type":"action"},{"command":{"actorId":"player","expectedRevision":3,"id":"fixture-4","operation":{"direction":{"x":1,"y":0},"kind":"walk","seconds":0.25},"sceneId":"scene:01ee46dde57641bdd295abe06cce10cf4c1b63c569354b4775561fb9f52bb77c"},"commandHash":"c93c849ab1fb86c28135af7886d16a8bf0aae9c320ca75fcbea6519c8d04dbac","events":[],"type":"action"},{"command":{"actorId":"player","expectedRevision":4,"id":"fixture-5","operation":{"direction":{"x":0,"y":1},"kind":"walk","seconds":0.25},"sceneId":"scene:01ee46dde57641bdd295abe06cce10cf4c1b63c569354b4775561fb9f52bb77c"},"commandHash":"a7b64284c27c9ec107b20f4b5c430e7b9a3e46da6baec477394e15eb10409ca4","events":[],"type":"action"},{"command":{"actorId":"player","expectedRevision":5,"id":"fixture-6","operation":{"intent":{"actorId":"player","actorRevision":5,"kind":"traverse-stairs","targetId":"fp:stairs:YS1zdGFpcnM:ZmxpZ2h0","worldId":"parts-conformance-yard","worldRevision":1},"kind":"interact"},"sceneId":"scene:01ee46dde57641bdd295abe06cce10cf4c1b63c569354b4775561fb9f52bb77c"},"commandHash":"e88ba7abf00ac985cd4ec294dece71777499254758498499c01b74b206bfca4d","events":[{"actorId":"player","id":"parts-conformance-yard/interactions/2","targetId":"fp:stairs:YS1zdGFpcnM:ZmxpZ2h0","type":"stairs-started","worldId":"parts-conformance-yard"}],"type":"action"},{"command":{"actorId":"player","expectedRevision":6,"id":"fixture-7","operation":{"kind":"advance","seconds":0.5},"sceneId":"scene:01ee46dde57641bdd295abe06cce10cf4c1b63c569354b4775561fb9f52bb77c"},"commandHash":"e17f5fd4d117e6d4472985696f9fd261835e34e68a738682582fe021451c3231","events":[],"type":"action"},{"command":{"eventIds":["parts-conformance-yard/interactions/1","parts-conformance-yard/interactions/2"],"expectedRevision":7,"id":"fixture-effects","sceneId":"scene:01ee46dde57641bdd295abe06cce10cf4c1b63c569354b4775561fb9f52bb77c"},"commandHash":"c80cfe6d37e1368797e09d315efa043451dccd95fab9bf880f4d25b16bb232a6","events":[],"type":"claim"}],"kind":"nautilus-parts-runtime","revision":8,"sceneId":"scene:01ee46dde57641bdd295abe06cce10cf4c1b63c569354b4775561fb9f52bb77c","version":1},"sceneId":"scene:01ee46dde57641bdd295abe06cce10cf4c1b63c569354b4775561fb9f52bb77c","version":1,"world":{"bounds":{"depthM":32,"heightM":8,"minHeightM":-0.12,"widthM":32},"entities":[],"floors":[{"elevationM":0,"id":"floor-0","index":0,"label":"1"},{"elevationM":2.12,"id":"floor-1","index":1,"label":"2"}],"id":"parts-conformance-yard","kind":"nautilus-extended-world","links":[{"bidirectional":true,"from":{"floorId":"floor-0","position":{"h":0,"x":5,"y":6},"surfaceId":"fp:surface:YS1ncm91bmQ:ZGVjaw:0"},"id":"fp:stairs:YS1zdGFpcnM:ZmxpZ2h0","kind":"stairs","to":{"floorId":"floor-1","position":{"h":2.12,"x":10.1,"y":6},"surfaceId":"fp:surface:YS11cHBlcg:ZGVjaw:6"}}],"name":"Two-story ABI conformance","profileId":"native-metres-v1","surfaces":[{"bounds":{"max":{"h":4.12,"x":11,"y":9.06},"min":{"h":2.12,"x":3,"y":8.94}},"floorId":"floor-1","id":"fp:surface:YS11LWJhY2s:d2FsbA:0","role":"solid","supportFloorId":null,"supports":false},{"bounds":{"max":{"h":4.12,"x":11,"y":3.06},"min":{"h":2.12,"x":3,"y":2.94}},"floorId":"floor-1","id":"fp:surface:YS11LWZyb250:d2FsbA:0","role":"solid","supportFloorId":null,"supports":false},{"bounds":{"max":{"h":4.12,"x":3.06,"y":9},"min":{"h":2.12,"x":2.94,"y":3}},"floorId":"floor-1","id":"fp:surface:YS11LWxlZnQ:d2FsbA:0","role":"solid","supportFloorId":null,"supports":false},{"bounds":{"max":{"h":4.12,"x":11.06,"y":9},"min":{"h":2.12,"x":10.94,"y":3}},"floorId":"floor-1","id":"fp:surface:YS11LXJpZ2h0:d2FsbA:0","role":"solid","supportFloorId":null,"supports":false},{"bounds":{"max":{"h":2.12,"x":5.2,"y":5.35},"min":{"h":2,"x":3,"y":3}},"floorId":"floor-1","id":"fp:surface:YS11cHBlcg:ZGVjaw:0","role":"solid","supportFloorId":"floor-1","supports":true},{"bounds":{"max":{"h":2.12,"x":5.2,"y":6.65},"min":{"h":2,"x":3,"y":5.35}},"floorId":"floor-1","id":"fp:surface:YS11cHBlcg:ZGVjaw:1","role":"solid","supportFloorId":"floor-1","supports":true},{"bounds":{"max":{"h":2.12,"x":5.2,"y":9},"min":{"h":2,"x":3,"y":6.65}},"floorId":"floor-1","id":"fp:surface:YS11cHBlcg:ZGVjaw:2","role":"solid","supportFloorId":"floor-1","supports":true},{"bounds":{"max":{"h":2.12,"x":9.35,"y":5.35},"min":{"h":2,"x":5.2,"y":3}},"floorId":"floor-1","id":"fp:surface:YS11cHBlcg:ZGVjaw:3","role":"solid","supportFloorId":"floor-1","supports":true},{"bounds":{"max":{"h":2.12,"x":9.35,"y":9},"min":{"h":2,"x":5.2,"y":6.65}},"floorId":"floor-1","id":"fp:surface:YS11cHBlcg:ZGVjaw:4","role":"solid","supportFloorId":"floor-1","supports":true},{"bounds":{"max":{"h":2.12,"x":11,"y":5.35},"min":{"h":2,"x":9.35,"y":3}},"floorId":"floor-1","id":"fp:surface:YS11cHBlcg:ZGVjaw:5","role":"solid","supportFloorId":"floor-1","supports":true},{"bounds":{"max":{"h":2.12,"x":11,"y":6.65},"min":{"h":2,"x":9.35,"y":5.35}},"floorId":"floor-1","id":"fp:surface:YS11cHBlcg:ZGVjaw:6","role":"solid","supportFloorId":"floor-1","supports":true},{"bounds":{"max":{"h":2.12,"x":11,"y":9},"min":{"h":2,"x":9.35,"y":6.65}},"floorId":"floor-1","id":"fp:surface:YS11cHBlcg:ZGVjaw:7","role":"solid","supportFloorId":"floor-1","supports":true},{"bounds":{"max":{"h":2,"x":11,"y":9.06},"min":{"h":0,"x":3,"y":8.94}},"floorId":"floor-0","id":"fp:surface:YS1nLWJhY2s:d2FsbA:0","role":"solid","supportFloorId":null,"supports":false},{"bounds":{"max":{"h":1.85,"x":4,"y":3.06},"min":{"h":0,"x":3,"y":2.94}},"floorId":"floor-0","id":"fp:surface:YS1nLWZyb250:d2FsbA:0","role":"solid","supportFloorId":null,"supports":false},{"bounds":{"max":{"h":2,"x":4,"y":3.06},"min":{"h":1.85,"x":3,"y":2.94}},"floorId":"floor-0","id":"fp:surface:YS1nLWZyb250:d2FsbA:1","role":"solid","supportFloorId":null,"supports":false},{"bounds":{"max":{"h":2,"x":5,"y":3.06},"min":{"h":1.85,"x":4,"y":2.94}},"floorId":"floor-0","id":"fp:surface:YS1nLWZyb250:d2FsbA:2","role":"solid","supportFloorId":null,"supports":false},{"bounds":{"max":{"h":1.85,"x":11,"y":3.06},"min":{"h":0,"x":5,"y":2.94}},"floorId":"floor-0","id":"fp:surface:YS1nLWZyb250:d2FsbA:3","role":"solid","supportFloorId":null,"supports":false},{"bounds":{"max":{"h":2,"x